"doi","container.title","title","author","type","publisher"
"10.1186/s12859-024-05637-5","BMC Bioinformatics","Tpgen: a language model for stable protein design with a specific topology structure","Xiaoping","journal-article","Springer Science and Business Media LLC"
"10.1021/acs.biochem.0c00533","Biochemistry","Rosetta-Enabled Structural Prediction of Permissive Loop Insertion Sites in Proteins","Joseph G.","journal-article","American Chemical Society (ACS)"
"10.1016/j.biotechadv.2013.04.008","Biotechnology Advances","In vitro regulatory models for systems biology","Anthony J.","journal-article","Elsevier BV"
"10.1111/febs.12892","The FEBS Journal","Ribosomal mutations affecting the translation of genes that use non‐optimal codons","Gidi","journal-article","Wiley"
"10.1111/febs.12532","The FEBS Journal","Time‐scale separation – Michaelis and Menten's old idea, still bearing fruit","Jeremy","journal-article","Wiley"
"10.1098/rsif.2008.0280","Journal of The Royal Society Interface","Maximal frustration as an immunological principle","F. Vistulo","journal-article","The Royal Society"
"10.1016/j.jtbi.2004.06.026","Journal of Theoretical Biology","How B cells and dendritic cells may cooperate in antigen purification","Jacques","journal-article","Elsevier BV"
"10.1111/j.1432-1033.1994.tb20059.x","European Journal of Biochemistry","Dissociation Rate of Cognate Peptidyl‐tRNA from the A‐Site of Hyper‐Accurate and Error‐Prone Ribosomes","Reza","journal-article","Wiley"
"10.1038/s41467-020-14806-y","Nature Communications","Energy consumption and cooperation for optimal sensing","Vudtiwat","journal-article","Springer Science and Business Media LLC"
"10.1016/j.isci.2021.103526","iScience","A synthetic distributed genetic multi-bit counter","Tianchi","journal-article","Elsevier BV"
"10.1103/revmodphys.92.025001","Reviews of Modern Physics","Theoretical perspectives on biological machines","Mauro L.","journal-article","American Physical Society (APS)"
"10.1016/j.plrev.2016.06.010","Physics of Life Reviews","When Maxwellian demon meets action at a distance","Valentin V.","journal-article","Elsevier BV"
"10.1371/journal.pone.0000244","PLoS ONE","Self-Organization of Anastral Spindles by Synergy of Dynamic Instability, Autocatalytic Microtubule Production, and a Spatial Signaling Gradient","Thomas","journal-article","Public Library of Science (PLoS)"
"10.1111/j.1469-185x.2008.00052.x","Biological Reviews","Robustness: confronting lessons from physics and biology","Annick","journal-article","Wiley"
"10.1103/physrevresearch.3.l032034","Physical Review Research","Thermodynamic uncertainty relation for first-passage times on Markov chains","http://orcid.org/0000-0001-6806-5431","journal-article","American Physical Society (APS)"
"10.1103/physrevlett.93.258103","Physical Review Letters","High-Fidelity DNA Sensing by Protein Binding Fluctuations","Tsvi","journal-article","American Physical Society (APS)"
"10.1016/j.jmb.2021.167189","Journal of Molecular Biology","The Alarmone (p)ppGpp Regulates Primer Extension by Bacterial Primase","Christina N.","journal-article","Elsevier BV"
"10.1016/j.jmb.2020.07.007","Journal of Molecular Biology","The Intrinsically Disordered N-terminal Extension of the ClpS Adaptor Reprograms Its Partner AAA + ClpAP Protease","Amaris","journal-article","Elsevier BV"
"10.1016/s0022-2836(03)00236-5","Journal of Molecular Biology","Understanding Discrimination by the Ribosome: Stability Testing and Groove Measurement of Codon–Anticodon Pairs","K.Y","journal-article","Elsevier BV"
"10.1002/bies.950060109","BioEssays","The error catastrophe: A molecular <i>Fata Morgana</i>","C. G.","journal-article","Wiley"
"10.1002/(sici)1521-1878(199802)20:2<181::aid-bies10>3.0.co;2-0","BioEssays","Underground metabolism","Richard","journal-article","Wiley"
"10.1002/bies.20010","BioEssays","Kinetic proofreading by the cavity system of myoglobin: protection from poisoning","Wilson","journal-article","Wiley"
"10.1002/bies.10369","BioEssays","Macromolecular complexes that unwind nucleic acids","Peter H.","journal-article","Wiley"
"10.1016/j.physrep.2020.01.001","Physics Reports","Quantitative immunology for physicists","http://orcid.org/0000-0002-7283-3162","journal-article","Elsevier BV"
"10.1016/j.physrep.2020.01.002","Physics Reports","Frenesy: Time-symmetric dynamical activity in nonequilibria","http://orcid.org/0000-0002-0188-697X","journal-article","Elsevier BV"
"10.1016/j.physrep.2013.03.005","Physics Reports","Stochastic mechano-chemical kinetics of molecular motors: A multidisciplinary enterprise from a physicist’s perspective","Debashish","journal-article","Elsevier BV"
"10.7124/bc.000873","Biopolymers and Cell","Epigenetics: What it is about?","E.","journal-article","Institute of Molecular Biology and Genetics (NAS Ukraine)"
"10.7124/bc.00082d","Biopolymers and Cell","Role of tRNAPro in pretransfer editing of alanine by prolyl-tRNA synthetase","K. S.","journal-article","Institute of Molecular Biology and Genetics (NAS Ukraine)"
"10.1039/d2cs00114d","Chemical Society Reviews","Translational PK–PD for targeted protein degradation","http://orcid.org/0000-0001-8099-9069","journal-article","Royal Society of Chemistry (RSC)"
"10.1073/pnas.1307288110","Proceedings of the National Academy of Sciences","Ribosomal ambiguity made less ambiguous","Peter B.","journal-article","Proceedings of the National Academy of Sciences"
"10.1073/pnas.1301585110","Proceedings of the National Academy of Sciences","Reorganization of an intersubunit bridge induced by disparate 16S
            <i>ribosomal ambiguity</i>
            mutations mimics an EF-Tu-bound state","Crystal E.","journal-article","Proceedings of the National Academy of Sciences"
"10.1073/pnas.0705988104","Proceedings of the National Academy of Sciences","The role of fluctuations in tRNA selection by the ribosome","Tae-Hee","journal-article","Proceedings of the National Academy of Sciences"
"10.1038/269655a0","Nature","Recent excitement in the DNA replication problem","Bruce","journal-article","Springer Science and Business Media LLC"
"10.1016/j.physa.2022.127735","Physica A: Statistical Mechanics and its Applications","Interplay of energy, dissipation, and error in kinetic proofreading: Control via concentration and binding energy","http://orcid.org/0000-0002-5892-0964","journal-article","Elsevier BV"
"10.1002/qua.560480710","International Journal of Quantum Chemistry","Pathways and mobile ? electrons in biological electron transfer","Sven","journal-article","Wiley"
"10.1038/nri2688","Nature Reviews Immunology","Pairing computation with experimentation: a powerful coupling for understanding T cell signalling","Arup K.","journal-article","Springer Science and Business Media LLC"
"10.1038/nri2469","Nature Reviews Immunology","Affinity threshold for thymic selection through a T-cell receptor–co-receptor zipper","Ed","journal-article","Springer Science and Business Media LLC"
"10.1126/science.1904626","Science","Mediation of the Attachment or Fusion Step in Vesicular Transport by the GTP-Binding Ypt1 Protein","Nava","journal-article","American Association for the Advancement of Science (AAAS)"
"10.1021/bi00588a039","Biochemistry","Structural and enzymological characterization of the homogeneous deoxyribonucleic acid polymerase from Mycoplasma orale","Linda Minium","journal-article","American Chemical Society (ACS)"
"10.1021/acs.jpcb.9b08380","The Journal of Physical Chemistry B","Allostery and Kinetic Proofreading","Vahe","journal-article","American Chemical Society (ACS)"
"10.1021/acs.jpcb.9b05722","The Journal of Physical Chemistry B","Stochastic Sequestration Promotes Specificity in Decision Making in Single Cells","Ciriyam","journal-article","American Chemical Society (ACS)"
"10.1128/mr.42.3.529-576.1978","Microbiological Reviews","Head morphogenesis of complex double-stranded deoxyribonucleic acid bacteriophages","H","journal-article","American Society for Microbiology"
"10.1128/mr.56.4.592-621.1992","Microbiological Reviews","Regulation by proteolysis: energy-dependent proteases and their targets","S","journal-article","American Society for Microbiology"
"10.1128/mr.60.1.103-134.1996","Microbiological Reviews","Programmed translational frameshifting","P J","journal-article","American Society for Microbiology"
"10.1128/mr.56.3.412-429.1992","Microbiological Reviews","Editing of errors in selection of amino acids for protein synthesis","H","journal-article","American Society for Microbiology"
"10.1042/bst0360567","Biochemical Society Transactions","What we have learned from ribosome structures","V.","journal-article","Portland Press Ltd."
"10.1098/rsfs.2022.0013","Interface Focus","The linear framework: using graph theory to reveal the algebra and thermodynamics of biomolecular systems","http://orcid.org/0000-0002-3594-6141","journal-article","The Royal Society"
"10.1038/nsmb.1880","Nature Structural &amp; Molecular Biology","Structural rearrangements of the ribosome at the tRNA proofreading step","Lasse","journal-article","Springer Science and Business Media LLC"
"10.1016/s0021-9258(19)51068-7","Journal of Biological Chemistry","Misincorporation and mispaired primer extension by human immunodeficiency virus reverse transcriptase.","S.","journal-article","Elsevier BV"
"10.1074/jbc.m110.105320","Journal of Biological Chemistry","Aminoacyl Transfer Rate Dictates Choice of Editing Pathway in Threonyl-tRNA Synthetase","Anand","journal-article","Elsevier BV"
"10.1074/jbc.m110.133553","Journal of Biological Chemistry","Partitioning of tRNA-dependent Editing between Pre- and Post-transfer Pathways in Class I Aminoacyl-tRNA Synthetases","Morana","journal-article","Elsevier BV"
"10.1016/j.pharmthera.2022.108175","Pharmacology &amp; Therapeutics","Why medicines work","David C.","journal-article","Elsevier BV"
"10.1007/bf00331638","Molecular and General Genetics MGG","How do combinations of rpsL − and miaA − generate streptomycin dependence?","I.","journal-article","Springer Science and Business Media LLC"
"10.1016/j.copbio.2018.01.029","Current Opinion in Biotechnology","There's (still) plenty of room at the bottom","Noah","journal-article","Elsevier BV"
"10.2119/molmed.2009.00026","Molecular Medicine","RNA Surveillance: Molecular Approaches in Transcript Quality Control and their Implications in Clinical Diseases","Karen C. M.","journal-article","Springer Science and Business Media LLC"
"10.1111/j.1432-1033.1979.tb12915.x","European Journal of Biochemistry","Translational Fidelity and Specificity of Ribosomes Cleaved by Cloacin DF13","Johan C.","journal-article","Wiley"
"10.1142/s0218339018500158","Journal of Biological Systems","COMPARISON OF A DUAL STRATEGY FOR T-CELL ACTIVATION UNDER INHIBITION OF THE CD4 RECEPTOR","http://orcid.org/0000-0001-9888-7700","journal-article","World Scientific Pub Co Pte Lt"
"10.1016/0014-5793(80)80211-0","FEBS Letters","A new mechanism for the hydrolytic editing function of aminoacyl‐tRNA synthetases","H.T.","journal-article","Wiley"
"10.1016/0014-5793(83)80519-5","FEBS Letters","Effect of codon shortening and the antibiotics viomycin and sparsomycin upon the behaviour of bound aminoacyl‐tRNA","Horst","journal-article","Wiley"
"10.3390/ijms22020952","International Journal of Molecular Sciences","A Peek Inside the Machines of Bacterial Nucleotide Excision Repair","Thanyalak","journal-article","MDPI AG"
"10.1021/nl502890g","Nano Letters","Direct Correlation of DNA Binding and Single Protein Domain Motion via Dual Illumination Fluorescence Microscopy","Mohamed","journal-article","American Chemical Society (ACS)"
"10.1371/journal.pcbi.1003300","PLoS Computational Biology","Unraveling Adaptation in Eukaryotic Pathways: Lessons from Protocells","Giovanna","journal-article","Public Library of Science (PLoS)"
"10.1371/journal.pcbi.1003016","PLoS Computational Biology","Synthetic Lethality between Gene Defects Affecting a Single Non-essential Molecular Pathway with Reversible Steps","Andrei","journal-article","Public Library of Science (PLoS)"
"10.1103/physrevlett.115.038102","Physical Review Letters","Physical Limit to Concentration Sensing Amid Spurious Ligands","Thierry","journal-article","American Physical Society (APS)"
"10.1016/j.semcdb.2011.03.009","Seminars in Cell &amp; Developmental Biology","Processive ubiquitin chain formation by the anaphase-promoting complex","Hermann-Josef","journal-article","Elsevier BV"
"10.1016/j.semcdb.2010.03.006","Seminars in Cell &amp; Developmental Biology","Protein quality control in the ER: The recognition of misfolded proteins","Pekka","journal-article","Elsevier BV"
"10.1002/bbpc.19770811216","Berichte der Bunsengesellschaft für physikalische Chemie","The Stirred Flow Reactor: Base Analog Incorporation in DNA Replication and Transcription","Ramachandra","journal-article","Wiley"
"10.1016/j.bpj.2014.09.038","Biophysical Journal","A Critical Residue Selectively Recruits Nucleotides for T7 RNA Polymerase Transcription Fidelity Control","Baogen","journal-article","Elsevier BV"
"10.1016/j.bpj.2013.04.042","Biophysical Journal","Modeling Stochastic Kinetics of Molecular Machines at Multiple Levels: From Molecules to Modules","Debashish","journal-article","Elsevier BV"
"10.1093/nar/gkac687","Nucleic Acids Research","Prp43/DHX15 exemplify RNA helicase multifunctionality in the gene expression network","http://orcid.org/0000-0001-6035-4255","journal-article","Oxford University Press (OUP)"
"10.1103/physrevlett.131.068401","Physical Review Letters","Physical Constraints in Intracellular Signaling: The Cost of Sending a Bit","http://orcid.org/0000-0002-2480-6127","journal-article","American Physical Society (APS)"
"10.1039/d3cp04410f","Physical Chemistry Chemical Physics","Trapping a non-cognate nucleotide upon initial binding for replication fidelity control in SARS-CoV-2 RNA dependent RNA polymerase","Moises E.","journal-article","Royal Society of Chemistry (RSC)"
"10.1126/science.1206629","Science","Initiation Complex Structure and Promoter Proofreading","Xin","journal-article","American Association for the Advancement of Science (AAAS)"
"10.1126/science.3510456","Science","The Context Effect Does Not Require a Fourth Base Pair","Don","journal-article","American Association for the Advancement of Science (AAAS)"
"10.1021/acs.biochem.9b00237","Biochemistry","Revisiting Trade-offs between Rubisco Kinetic Parameters","Avi I.","journal-article","American Chemical Society (ACS)"
"10.1021/bi00302a020","Biochemistry","T4 RNA ligase mediated preparation of novel ""chemically misacylated"" tRNAPhes","Thomas G.","journal-article","American Chemical Society (ACS)"
"10.1103/physreve.99.060401","Physical Review E","Histone mark recognition controls nucleosome translocation via a kinetic proofreading mechanism: Confronting theory and high-throughput experiments","Ralf","journal-article","American Physical Society (APS)"
"10.1103/physreve.99.052101","Physical Review E","Nonequilibrium abundances for the building blocks of life","Elan","journal-article","American Physical Society (APS)"
"10.1103/physreve.99.022423","Physical Review E","Receptor crosstalk improves concentration sensing of multiple ligands","Martín","journal-article","American Physical Society (APS)"
"10.1021/jp026753k","The Journal of Physical Chemistry B","Theoretical Understanding of the Interprotein Electron Transfer between Cytochrome <i>c</i><sub>2</sub> and the Photosynthetic Reaction Center","Osamu","journal-article","American Chemical Society (ACS)"
"10.1021/acschembio.9b00973","ACS Chemical Biology","Characterization of Arylalkylamine <i>N</i>-Acyltransferase from <i>Tribolium castaneum</i>: An Investigation into a Potential Next-Generation Insecticide Target","http://orcid.org/0000-0002-4593-4371","journal-article","American Chemical Society (ACS)"
"10.1016/j.bpj.2017.11.1170","Biophysical Journal","Two-Step Membrane Binding by the Bacterial SRP Receptor Enables Efficient and Accurate Co-Translational Protein Targeting","Yu-Hsien","journal-article","Elsevier BV"
"10.1016/s0161-5890(02)00065-2","Molecular Immunology","Quantitative aspects of signal transduction by the receptor with high affinity for IgE","Henry","journal-article","Elsevier BV"
"10.1016/s0021-9258(17)30277-6","Journal of Biological Chemistry","On the fidelity of DNA replication. Accuracy of Escherichia coli DNA polymerase I.","S.S.","journal-article","Elsevier BV"
"10.1016/s0021-9258(17)34673-2","Journal of Biological Chemistry","An ATP stimulation of T4 DNA polymerase mediated via T4 gene 44/62 and 45 proteins. The requirement for ATP hydrolysis.","J.R.","journal-article","Elsevier BV"
"10.1074/jbc.m113.546515","Journal of Biological Chemistry","A Fundamental Trade-off in Covalent Switching and Its Circumvention by Enzyme Bifunctionality in Glucose Homeostasis","Tathagata","journal-article","Elsevier BV"
"10.1080/01496398208068550","Separation Science and Technology","Microheterogeneous Collagen Model on the Basis of a Chromatographic Study on Hydroxyapatite Columns","Tsutomu","journal-article","Informa UK Limited"
"10.1016/j.copbio.2013.04.008","Current Opinion in Biotechnology","Optimality in evolution: new insights from synthetic biology","Marjon GJ","journal-article","Elsevier BV"
"10.1016/j.copbio.2009.08.006","Current Opinion in Biotechnology","Engineering multicellular systems by cell–cell communication","Anand","journal-article","Elsevier BV"
"10.1006/jtbi.2000.2163","Journal of Theoretical Biology","Kinetic Proofreading Scanning Models for Eukaryotic Translational Initiation: the Cap and Poly(A) Tail Dependency of Translation","XIPING","journal-article","Elsevier BV"
"10.1016/j.aam.2019.06.001","Advances in Applied Mathematics","Complexity of model testing for dynamical systems with toric steady states","Michael F.","journal-article","Elsevier BV"
"10.1038/s41467-018-03826-4","Nature Communications","Design principles for enhancing phase sensitivity and suppressing phase fluctuations simultaneously in biochemical oscillatory systems","http://orcid.org/0000-0002-8287-4347","journal-article","Springer Science and Business Media LLC"
"10.1093/nar/gku1370","Nucleic Acids Research","Five checkpoints maintaining the fidelity of transcription by RNA polymerases in structural and energetic details","Beibei","journal-article","Oxford University Press (OUP)"
"10.1016/0014-5793(84)80617-1","FEBS Letters","Stoichiometry of GTP hydrolysis in a poly(U)‐dependent cell‐free translation system","L.P.","journal-article","Wiley"
"10.3390/ijms21249449","International Journal of Molecular Sciences","Molecular Insights into Determinants of Translational Readthrough and Implications for Nonsense Suppression Approaches","http://orcid.org/0000-0003-2918-4010","journal-article","MDPI AG"
"10.1038/nrm2203","Nature Reviews Molecular Cell Biology","Mechanisms of specificity in protein phosphorylation","Jeffrey A.","journal-article","Springer Science and Business Media LLC"
"10.1063/1.5004793","The Journal of Chemical Physics","Thermodynamic framework for information in nanoscale systems with memory","http://orcid.org/0000-0001-6802-0874","journal-article","AIP Publishing"
"10.3390/e21121212","Entropy","Dissipation in Non-Steady State Regulatory Circuits","Paulina","journal-article","MDPI AG"
"10.3390/e21080743","Entropy","Maximum Entropy Production Theorem for Transitions between Enzyme Functional States and Its Applications","Davor","journal-article","MDPI AG"
"10.1371/journal.pcbi.1002144","PLoS Computational Biology","A Peptide Filtering Relation Quantifies MHC Class I Peptide Optimization","Neil","journal-article","Public Library of Science (PLoS)"
"10.1371/journal.pcbi.1001069","PLoS Computational Biology","Gene Expression Noise in Spatial Patterning: hunchback Promoter Structure Affects Noise Amplitude and Distribution in Drosophila Segmentation","David M.","journal-article","Public Library of Science (PLoS)"
"10.1371/journal.pcbi.1000804","PLoS Computational Biology","Enhancement of Transport Selectivity through Nano-Channels by Non-Specific Competition","Anton","journal-article","Public Library of Science (PLoS)"
"10.1371/journal.pbio.2006459","PLOS Biology","A speed–fidelity trade-off determines the mutation rate and virulence of an RNA virus","William J.","journal-article","Public Library of Science (PLoS)"
"10.3934/biophy.2015.4.398","AIMS Biophysics","Kinetic proofreading of chromatin remodeling: from gene activation to gene repression and back","Raghvendra","journal-article","American Institute of Mathematical Sciences (AIMS)"
"10.1109/memb.2006.1578663","IEEE Engineering in Medicine and Biology Magazine","The quest for error correction in biology","M.K.","journal-article","Institute of Electrical and Electronics Engineers (IEEE)"
"10.1103/physreve.92.060101","Physical Review E","Michaelis-Menten reaction scheme as a unified approach towards the optimal restart problem","Tal","journal-article","American Physical Society (APS)"
"10.1103/physreve.92.032702","Physical Review E","Energy dissipation drives the gradient signal amplification through an incoherent type-1 feed-forward loop","Ganhui","journal-article","American Physical Society (APS)"
"10.1103/physreve.92.022716","Physical Review E","Ribosome utilizes the minimum free energy changes to achieve the highest decoding rate and fidelity","Ping","journal-article","American Physical Society (APS)"
"10.1073/pnas.1610917113","Proceedings of the National Academy of Sciences","Two proofreading steps amplify the accuracy of genetic code translation","http://orcid.org/0000-0003-4518-0618","journal-article","Proceedings of the National Academy of Sciences"
"10.1016/j.devcel.2019.04.031","Developmental Cell","Anillin Promotes Cell Contractility by Cyclic Resetting of RhoA Residence Kinetics","Srikanth","journal-article","Elsevier BV"
"10.1038/s41586-020-2447-x","Nature","Cryo-EM of elongating ribosome with EF-Tu•GTP elucidates tRNA proofreading","Anna B.","journal-article","Springer Science and Business Media LLC"
"10.1103/physreve.63.031909","Physical Review E","Kinetic proofreading can explain the supression of supercoiling of circular DNA molecules by type-II topoisomerases","Jie","journal-article","American Physical Society (APS)"
"10.1002/cphc.202200644","ChemPhysChem","Understanding the Target Search by Multiple Transcription Factors on Nucleosomal DNA","Sujeet","journal-article","Wiley"
"10.1021/bi00505a025","Biochemistry","Role of the .beta.-phosphate and .gamma.-phosphate interchange reaction of adenosine triphosphate in amino acid discrimination by valyl- and methionyl-tRNA synthetases from Escherichia coli","Linda Tombras","journal-article","American Chemical Society (ACS)"
"10.1103/physreve.98.012420","Physical Review E","Energy-speed-accuracy relation in complex networks for biological discrimination","Felix","journal-article","American Physical Society (APS)"
"10.1016/j.cell.2006.05.045","Cell","A Luminal Surveillance Complex that Selects Misfolded Glycoproteins for ER-Associated Degradation","Vladimir","journal-article","Elsevier BV"
"10.1016/j.cell.2005.10.032","Cell","The Processivity of Multiubiquitination by the APC Determines the Order of Substrate Degradation","Michael","journal-article","Elsevier BV"
"10.1016/j.cell.2005.09.034","Cell","Chromosome Sites Play Dual Roles to Establish Homologous Synapsis during Meiosis in C. elegans","Amy J.","journal-article","Elsevier BV"
"10.1016/s0021-9258(17)33149-6","Journal of Biological Chemistry","Control of mutation frequency by bacteriophage T4 DNA polymerase. I. The CB120 antimutator DNA polymerase is defective in strand displacement.","F D","journal-article","Elsevier BV"
"10.1016/s0021-9258(18)67064-4","Journal of Biological Chemistry","On the fidelity of DNA synthesis. Pyrophosphate-induced misincorporation allows detection of two proofreading mechanisms.","T A","journal-article","Elsevier BV"
"10.1074/jbc.m113.544429","Journal of Biological Chemistry","Doc Toxin Is a Kinase That Inactivates Elongation Factor Tu","Jonathan W.","journal-article","Elsevier BV"
"10.1016/s0958-1669(02)00329-4","Current Opinion in Biotechnology","Dimensionality is the issue: use of photoaptamers in protein microarrays","Helen","journal-article","Elsevier BV"
"10.1111/j.1432-1033.1979.tb02041.x","European Journal of Biochemistry","The Binding of Non-cognate Tyr-tRNATyr to Poly(uridylic acid)-Programmed Escherichia coli Ribosomes","Sonsoles","journal-article","Wiley"
"10.1038/nrm2023","Nature Reviews Molecular Cell Biology","Back to the future: education for systems-level biologists","Ned","journal-article","Springer Science and Business Media LLC"
"10.1038/nrm1588","Nature Reviews Molecular Cell Biology","Thinking quantitatively about transcriptional regulation","Sandra J.","journal-article","Springer Science and Business Media LLC"
"10.1021/ja3095558","Journal of the American Chemical Society","Cascade of Reduced Speed and Accuracy after Errors in Enzyme-Free Copying of Nucleic Acid Sequences","Kevin","journal-article","American Chemical Society (ACS)"
"10.3390/e20050368","Entropy","Writing, Proofreading and Editing in Information Theory","http://orcid.org/0000-0001-6802-0874","journal-article","MDPI AG"
"10.3390/e20040306","Entropy","Balancing Non-Equilibrium Driving with Nucleotide Selectivity at Kinetic Checkpoints in Polymerase Fidelity Control","Chunhong","journal-article","MDPI AG"
"10.1371/journal.pcbi.0030125","PLoS Computational Biology","Efficiency, Selectivity, and Robustness of Nucleocytoplasmic Transport","Anton","journal-article","Public Library of Science (PLoS)"
"10.3390/genes2040998","Genes","Antifragility and Tinkering in Biology (and in Business) Flexibility Provides an Efficient Epigenetic Way to Manage Risk","Antoine","journal-article","MDPI AG"
